{
  "kind": "source-bundle",
  "contractVersion": "1.0.0",
  "id": "synthetic/kepware-like/bundle",
  "version": "1.0.0",
  "body": {
    "origin": "synthetic",
    "captureScope": "unknown",
    "artifacts": [
      {
        "artifactId": "project",
        "path": "artifacts/project.json",
        "sha256": "30875cea43c793ec9d43194c7d9c32c72413531f55d13c122eba8f9084a6ca18",
        "sizeBytes": 688,
        "role": "configuration",
        "obtained": { "at": "2026-10-21T00:00:00Z", "method": "export" }
      }
    ],
    "productClaims": [
      { "subject": "product", "value": "synthetic-kepware-like", "basis": "stated-by-provider" },
      { "subject": "driver", "value": "synthetic-driver", "basis": "observed-in-artifact", "artifactIds": ["project"] },
      { "subject": "version", "value": "not stated", "basis": "unknown" }
    ]
  },
  "digest": "e384a53b3df6355463a06be1357224d6601f637a5ec559431253bd690185159e"
}
