{
  "kind": "source-bundle",
  "contractVersion": "1.0.0",
  "id": "synthetic/pio-like/bundle",
  "version": "1.0.0",
  "body": {
    "origin": "synthetic",
    "captureScope": "partial",
    "artifacts": [
      {
        "artifactId": "config",
        "path": "artifacts/config.txt",
        "sha256": "9c479cc2b40db96edc8fcd2b9392aae9096f78fa37ae3a191f63c933ccf58ca3",
        "sizeBytes": 304,
        "role": "configuration",
        "obtained": { "at": "2026-10-21T00:00:00Z", "method": "handed-over" }
      },
      {
        "artifactId": "connection",
        "path": "artifacts/connection.txt",
        "sha256": "f211ed3f545d0faf7f63a20e74d36629767fd657b8e5fc96d492d74dd72ac044",
        "sizeBytes": 173,
        "role": "configuration",
        "obtained": { "at": "2026-10-21T00:00:00Z", "method": "handed-over" }
      },
      {
        "artifactId": "connection-redacted",
        "path": "artifacts/connection-redacted.txt",
        "sha256": "6558282ee56eef33eca8c9dbba787f4d608fe11f8183ec13a2d8b8193c3c27ec",
        "sizeBytes": 155,
        "role": "redacted-copy",
        "obtained": { "at": "2026-10-21T00:00:00Z", "method": "handed-over" },
        "redaction": { "derivedFrom": "connection", "removedFields": ["password"] }
      }
    ],
    "productClaims": [
      { "subject": "product", "value": "synthetic-pio-like", "basis": "stated-by-provider" },
      { "subject": "format", "value": "synthetic-ini-like", "basis": "observed-in-artifact", "artifactIds": ["config"] }
    ]
  },
  "digest": "78bd46e87f732db0f19125d89e8d23a736070f8c5e3222d17efb622922d34e18",
  "envelope": { "createdAt": "2026-10-21T00:00:00Z" }
}
